score,review
5,"This place is hands down my favorite hotel in Flagstaff. Generally good pricing. Choices between bedroom with own bath, or bedroom with a bath shared by the whole floor ($30 dollar price difference usually). I always go with shared bath because it doesnt make much...More"
3,"The hotel was charming with its old character, but was unable to get any sleep as the noise from the bar below was noisy, and the police outside the hotel below our window breaking up a disturbance, then what sounded like some of the employees...More"
3,"The bed was comfortable, room was good size and the bathroom had its difficulties. Apparently this room was deemed the meat man room. My ex isn't big on the paranormal, however I am. We didn't really do any investigating but we did a lot of...More"
3,"OK, this is a very old hotel that has some charm, the rooms have hardly changed which adds to the charm but they are not to the modern day hotel rooms we have come to expect. So this is a hotel that is popular with...More"
4,"The location is great and parking right around the back.
Cute coffee shop down stairs on the corner
Clean and tidy
Staff are friendly and helpful
The property is old but it is well maintained.
The management don't advertise it for anything that it isn't,...More"
2,We looked for a central location and settled on the Hotel Monte Vista. We found it comparatively pricey for the room. The AC is not up to the job and the toilet cistern in our room leaked water all over the floor. I would have...More
4,"As mentioned - location is great. Near anything you need to get to in this town.
Lobby bar is great; pricing and service.
Downstairs bar not so much. Cocktail servers linger at the bar, bartender walked past us with nothing in front of us at...More"
4,"Wanted to see this historic hotel, which has housed the rich and famous. Desk staff told me I couldn't take pictures, which is too bad since there are some good photo ops for the 1920's style hotel and lounge. Comfortable lounge area in front with...More"
2,"October 9th my friend and I stayed the night. The hotel is located off San Francisco St. The hotel is located close to many shops, restaurants and bars. My friend was the one who booked the room. I was excited to stay considering I have...More"
2,"Drywall cracking, olde tyme posters look like they have dust from the 70's, light emitting windows with lackluster fabric drapes, middle of the night noise disturbing sleep, and inattention to details makes this place avoidable. It could be fun to locate yourself in the middle...More"
5,Hotel Monte Vista is in downtown Flagstaff. Many restaurants are within walking distance. Hotel is old however the room was clean. Recommend staying on the fourth floor since there is a bar on the ground floor.
1,"First their web page is misleading.  This is a party hotel  I stayed their this past MONDAY night the barS yes BARS, stay open till 2 am.  The college students jammed the place full and they are loud, there is no restaurant, they turned it...More"
5,"We have stayed at the Hotel Monte Vista several times now and plan to stay there on every trip we take to Flagstaff.  The location is perfect for those who want to explore Flagstaff's historic downtown on foot, with lots of shopping, restaurants, and nightlife...More"
1,I emplore everyone to listen to the trip advisor reviews for this hotel. The Monte Vista has more 1 stars than 5 stars and this is for a reason. The rooms are ridiculously small and everything about them are as such from the bathrooms to...More
4,"Sweet old hotel in bustling old downtown Flagstaff. Tons of restaurants and stuff to do nearby, quirky clean room with cable TV and mediocre Internet. Limited parking, but the staff was very accommodating. We requested a room away from the lounge and nightlife, and although...More"
5,"This is a great old hotel but don't think you're getting every bell and whistle at a five star hotel.  The rooms are funky with small bathrooms and showers but it has character; character, character.   Located downtown close to virtually every place you would want...More"
4,"My brother lives in Flagstaff, this was my first visit. I was given choice by my mom (who paid) did I want grand historic or conventional hotel. I am so glad I choose grand historic. It was in the center of everything. The service was...More"
4,"The hotel is a beautiful old building with a great big neon sign on top of it. There's nothing fancy about the place - if you're looking for anything more than clean, affordable 3 star accommodation, the Monte Vista probably isn't for you. If you're...More"
2,"Having grown up in Flagstaff, and as one who enjoys downtown flagstaff, thought it would be fun to stay downtown during a trip to visit family.  Big mistake.  Super loud party downstairs in bars downstairs very late.  For the rates, the towels are postcard stamp...More"
5,"This hotel is better than in the pictures online! The employees are great and the areas ambient is young and full of energy! Love this part of Flag and love this hotel! 
Tips: there are no ice machines but bar downstairs gives you if you...More"
3,"We stayed at the Hotel Monte Vista for one night to get away from the heat of mid-summer Phoenix. It is a great example of early 20th century Americana (think classic Route 66, built in 1926.) The town of Flagstaff is well worth the trip....More"
2,"While the location and the charming lobby were very appealing, the room we had was shabby, poorly maintained and required the intervention of the Manager to fix and make work several items (lights, television). We requested extra hangers and had to ask multiple times. The...More"
1,"the room was refurbished but with a washbasin too small to use, the room was dusty in places,(window area TV set etc.). If staying check where to park as we were not given details and ended up paying $150 to unclamp our hire car. We...More"
5,"Everything about Hotel Monte Vista is wonderful. As soon as we walked into the lobby, we felt like we had entered another era. Every staff member was extremely courteous and helpful, including the staff at the coffee/bar, ""Rendezvous"" (which has amazing coffee and a great...More"
4,"Although charming, this hotel is very, very old. Room was very clean and we were happy to see an air conditioning unit inserted into our window because Flagstaff was experiencing some extreme high temperatures during our stay. Small parking lot so get there early enough...More"
1,"Went up for a concert and booked two rooms, one for us and one for the kiddos. Chose this hotel due to the downtown location. Woke up around 5:30 am to something crawling on me. I sat up and saw a little bug in the...More"
3,"We prefer historic hotels.  Flagstaff has only two or maybe three historic HOTELS, the rest are 1950's MOTELS or the modern line-up of travelers hotel/motels.  The Hotel Monte Vista has been our choice when seeking to be downtown for the activities OR when we are...More"
3,"And by frills I mean central air conditioning. The rooms are named after people who stayed there. Ours was named for a whiskey, Jack Daniels. It was two rooms, with a double bed each, joined by a jack and jill bathroom. It was noisy at...More"
1,The staff was rude and not helpful. The air conditioner was loud and woke me up in the middle of the night. The carpet was dirty and just gross. The only positive feature the hotel has going for it is the location.
4,"Loved the room and location, however the bathroom was under par. The shower was exceptionally tiny and became a nuisance. The sink was in the room and had no where to put anything. The window unit ac was chugging along and probably would not suffice...More"
4,Stayed here on a Thursday night on our way to the Grand Canyon. Hotel is in a perfect location for walking around to all the bars and restaurants. It's a historical hotel and had that ambiance to it. Had room 217 which was off the...More
4,"We stayed at this hotel one night and while it's not a five star experience, it was a fun and memorable stay.  The rooms are weird but they are clean.  We didn't see any ghosties - location is in the heart of historic downtown so...More"
5,"This hotel was on point. Each room is named after a famous or notable person, and an employee walking by was happy to give us a brief history of ours. We stayed in 210, which is a corner room overlooking San Francisco and Aspen. Anyway...More"
3,"We stayed 2 nights in the Bob Hope suite.  It's two bedroom with one bathroom.  The beds were comfortable, the room was clean but old furnishings.  It was an interesting place.  I found the front desk not to be friendly or very helpful.  The coffee...More"
3,"We just got back from our stay at the monte vista for a night in 412. Sure the place is old, but it's also oozing with charm.  Granted I've looked at some room pictures on here and think you have to opt for a pricier...More"
4,This purportedly haunted historic establishment does have an aura conducive to ghostly aberrations. The 5 story hotel built in 1928 is situated in the heart of Flagstaffs historic district and has all the appurtenances needed for ethereal appearances. Walking into the Monte Vista is like...More
3,"My impression of this hotel started when I called to book it a few days out. The front desk clerk was less than friendly and polite. When she gave me a rate for a one-night stay, I told her I had the hotel website up...More"
1,"Stayed here for one night. I was ok with no bath in the room, even though we had to pay $90. Hotel lobby is charming -- supposedly haunted! -- staff very friendly.
We stayed in room 208. As soon as opening the door, we were...More"
4,"This place was wonderful. Our experience, we had very attentive service. The price points were completely acceptable and they have deals running from time to time. Its historic ""haunted"", and connected to bars, coffee shops and clubs. It's in a great location. The rooms have...More"
4,"This is an old fasioned dowton hotel.  Our room was a king room with plenty of space.  The bathroom was tight.  Parking is around the corner, and you may have issues parking on a busy day.  But parking opens up in the evenings."
3,One night stay here. Unfortunately no ghost. Stayed on the street side which was a mistake. Very loud. Awake and multiple times during the night. staff were polite . parking is a problem.    comfortable otherwise
4,"We stayed for a night with my family. We had a clean room with nice decor. The hotel is a historic place with a fun and unique lounge atmosphere. I enjoyed the place so much and would love to stay again. Despite apathetic staff, this...More"
4,"If you want a Hilton stay there don't come here for the homogenised modern hotel go the Monte Vista for something very different indeed
Staff were helpful bar was busy but service was good 
Would I stay again absolutely and would try any of the...More"
4,We drove by all the chain motels on our way into Flagstaff from the airport and I'm glad we booked into the Monte Vista. It has character and history and is located right in the middle of the historic area of Flagstaff.
3,We stayed here Friday December 19th in the Clark Gable room. The lady at check in was very attentive and helpful check in was quick and efficient. The room was large as others have reported the bathroom was small but clean and everything worked! The...More
1,"We stayed here for 1 night after a road trip to the Grand Canyon.  Poor service at check in. Wifi didn't work when we first arrived and was very spotty the next morning, when we commented on this at check out we were told that...More"
1,"We recently stayed one night on the recommendation it was close to the Orpheum theater, where we had tickets for a show. That's the only plus. The carpets were not only stained, but looked like they had not even been vacuumed. The pillows must have...More"
3,"We stayed at the Hotel Monte Vista for one night while traveling from Phoenix to the Grand Canyon.

The room (407) was pretty spacious and included a king-sized bed (but only 2 relatively small pillows).  The bathroom was pretty small, and had the tiniest shower...More"
1,"There was a raging party in the room next to us last night. No one did anything about it. The lobby and the restraunt and bar are lovely. The room needs new flooring, curtains, pillows, and bedding. The shower is tiny and you can hear...More"
4,Our son booked us a room at the Monte Vista because we needed a break.  We sure were happy he did.  We were on the second floor with a bar right below our room.  He was worried that it was going to be too noisy...More
4,"Enjoyed our stay. Room was clean and the bed was comfortable. Bear, in the cocktail bar made our 5 year old, the biggest,  best Shirley Temple ever. Christopher,  from housekeeping,  shared several fun ghost stories and let us see a number of rooms. It was...More"
5,"The Monte vista is a very popular haunted hotel. We stayed in the john Wayne room. Outstanding!  If you take the stairs you might see other ""former guests"" from years gone by. The location is perfect for anything you might want.  The staff is great....More"
4,"My husband and I decided to go to Flagstaff for the first time for my husbands birthday. We didn't book a hotel ahead of time, we thought we would just drive up to Flagstaff and find a place. We weren't very impressed with Flagstaff until...More"
4,"We had a Two Queen Room Suite, w/ connecting bath, dramatically decorated in red. The room and bath were clean. The bed ok. Wifi worked well.  Friendly staff. 

The hotel has a great location. Flagstaff has great shops and restaurants to wondering around within walking...More"
3,I have to start by saying that the staff was GREAT!!  I had an immediate issue with a locking window right when I checked in and two people walked up with me immediately and took care of it (I was not slamming it hard enough)....More
3,"The location is perfect for shops, restaurants and bars, but the hotel feels very dated and even a bit dirty. It has character but the rooms are very dark and weren't very comfortable. We stayed in other old hotels throughout AZ, but they at least...More"
4,"We reserved a room at this place anticipating an elegant ""from another time"" feel, which it very much was not.  However, The rooms were nice, and the bar downstairs seemed very popular with a live band."
2,"The only things redeeming about this hotel are location and the Rendezvous Bar. Otherwise, go somewhere else.   The rooms are VERY worn down and dated, the bathrooms very small, the towels even tinier, I asked for an extra towel or two at the front desk...More"
1,They Don't clean their rooms and the staff is extremely rude!!! The cleaning staff asks for tips but leave used condoms by your bed. We told the manager and they never bothered to refund the $140 per night or even apologize for that matter. Stay...More
1,"The Monte Vista markets itself to stupid people by claiming to be haunted, but the hotel is only haunted by what it could be if the owners put minimal effort into upkeep. The historic brick exterior hides a tremendous dump, and the horribleness of this...More"
4,"We visited the Monte Vista this summer. The location is great. It was exactly where we needed to be--close to NAU and walking distance in downtown. We had a suite, which was small but clean and worked well for our needs (parents and an adult...More"
3,"The Monte Vista is right in the heart of downtown Flagstaff within walking distance to many bars and restaurants.  The hotel staff, from the bar to the Front Desk, were incredibly friendly and helpful.  They were able to direct us to everything we needed, from...More"
1,"I wanted to stay here because of the historical nature of it. I enjoy visiting historical places. I did my homework online about this place... reserved a 4th floor, with bathroom included. We already knew the parking situation (its basically 10 spaces for the entire...More"
3,Historic AND Haunted! Or so they say ... I didn't hear any bellboy roaming the halls at night knocking on doors. Reasonably priced ... around $70. We were on the 2nd floor right above the street and it was loud all night with drunk people...More
5,We checked in late at night without a reservation.  Great service by Brandon.  We loved the historic room with a brass bed.  Great soaking tub and hot water.  Romantic decor.  Walking distance to several night spots and the University campus. We had a great time.
4,First understand that Flagstaff is a College town and that the old downtown area will have parking challenges. Notice also that downtown Flagstaff has a lot of bars. If you want a quiet night sleep uninterrupted by folks yelling stuff in the street at 2am...More
4,Older building but nice receptionista - OK to sleep - Friendly Bar staff and all in all very good located/ fine for travelers...ll go back! We liked it! Scenic Building in a scenic Village...cool Breakfast Muffins looked well home made ??...
1,"You can't pay me enough to stay at this hotel again. I arrived at 3pm check-in time, was told 1 room was not ready. I was given the room keys for that room but refused the keys to the other. Turns out both rooms were...More"
4,"Stayed here for 5 nights and thoroughly enjoyed it. It was cheap, came with parking and free internet. For the price you do get what you pay for. My room was big with a tiny shower and toilet. Internet was flakey and the parking was...More"
3,"parking was a problem.  you get a paper for your dashboard, then go find something in the public parking areas.  as I was there on a Friday, the streets were full and I parked about 3 blocks away.  not convenient to carry one's suitcases.
the...More"
5,"I can't count how many times I have stayed here,  I love this property ..  and yes, there is bar noise and train noise on the street side. If you need quiet,  ask for a room on the back side of the hotel,  less to...More"
3,"If you stay in this ""haunted hotel"" be aware you won't sleep, but it's not the baby crying ghosts, it's the people that stay in the street after the bar closes, from 2am to 4am, you are better off if you join them. 
But I...More"
2,"Driving on the route 66 we spent one night to relax and to enjoy the charm of this hotel, but nothing was true.
All the room on the main street are tremendously noisy, there was no hot water cause a not defined problem (even if...More"
5,"So glad we found the Monte V for our night in Flagstaff before heading out to the Canyon the next morning.  What a fun place!  The employee at the desk was super-nice, and the rooms were quaint a clean.  We would have been bored senseless...More"
2,"Getting really bored of the sweltering summer in Phoenix, my husband and I decided to take a trip up to Flagstaff for the night to enjoy some cooler mountain air. I chose to stay at the Monte Vista for its location which was central to...More"
5,I decided to stay at a Historial landmark hotel because they usually have a lot of character and can claim to be haunted. The rooms are named after movie stars. Monte Vista is right in the middle of downtown Flagstaff. The rooms are adequate and...More
5,"My boyfriend and I stopped here on our way to New Mexico from Vegas, and loved it.  Each room has their individual characteristics.  We stayed in the Freddie Mercury room.  It overlooked the street, and the bed was really comfortable. There are also several cool...More"
5,"We loved our experience at the Monte Vista in downtown Flagstaff.  The decor is wonderful, definitely more vintage in character.  The staff were exceptionally helpful and friendly, especially, Dean, the Barista.  Will be visiting again soon!"
5,"Of course the 'Old world' charm of this hotel means it is cared for and beautifully furnished. We stayed in Clark Gables suite overlooking the street and found the room warm, cosy with a great ambience. Wonderful, helpful staff and a great location in the...More"
5,The Hotel Monte Vista is a reminder of an elegant time.  The rooms are small but clean and nicely maintained. The girl at the front desk was very helpful and was able to recommend restaurants and drinks...exactly what you would hope for.  We were told...More
4,"No, we didn't see a ghost!  The rooms are small but really cool if you like historic hotels. We really enjoyed our stay at the Monte Vista. My husband and I also had a cocktail in the bar there. It was quaint. Totally worth staying...More"
4,"We loved the charm of this historic hotel, and the idea of all the old film stars having stayed there. We had a back room so no problem with noise. The room was spacious and very comfortable. The staff were very helpful, recommended a wonderful...More"
2,I recently stayed at the Monte Vista for Memorial Day weekend.  The location of the hotel is great.  The service is pretty good.  The noise level is completely unacceptable. The walls are paper thin and you can hear the music in the club and noises...More
3,"The best thing about this place is the location, in the heart of Flagstaff's historic downtown. Otherwise, my room was drab and pricey for what it was (I paid $100 for a room with a queen-sized bed and private bath). Just a little bit of...More"
4,"My daughter recommended that we stay here - she mentioned that it's not the most modern hotel but it was nostalgic.  The hotel is very central to downtown which we found very convenient.  The room was clean, the bed comfortable and the bathroom was very...More"
5,"We had nowhere booked in flagstaff and went first to the monte vista as it's got the great big sign on top!! The room was affordable (around $89 plus tax) it wasn't huge, but it was clean and very comfortable.  The room was kind of...More"
5,"We have stayed several times at the Monte Vista on ghost hunting trips . The rooms are clean warm and very comfy ! We always get the Bon Jovi Room , also known as the Rocking chair room . And have had much success as...More"
4,"I stay at the Monte Vista once a year, and have never had any complaints. Keep in mind it is a historic hotel and only so many upgrades can be made. Stayed on 3/28/14. The room was remodeled from last year, bed extremely comfortable, soft...More"
3,"We stayed for two nights and for being an older hotel we thought that the atmosphere and the rooms were pretty cool. The staff was extremely rude! So disrespectful, they ignored us, wouldnt look at us when we spoke with them, they were not helpful...More"
1,My fiancé and I thought a one night getaway would be relaxing. The lobby is beautiful the staff is very friendly. The hotel rooms are horrible. There is a sink in the room very very dark. The shower and toilet is so tiny you can...More
2,"I've stayed in numerous historic, character, haunted and local flavor hotels. This one is low on the list in terms of quality and value. Nothing worse than waking up at 12:30 to the sounds of the couple in the next room making each other very...More"
1,We recently stayed at this hotel on a Friday night. It is an old hotel and the lobby has lots of charm but that is about all. For $100 our room on the second floor was way overpriced. It was the size of a large...More
1,"I am a hotel General Manager. I have never experienced the lack of service that I was confronted with at this Hotel anywhere else in my professional or personal travels. It is a shame, quite honestly, because the property itself is well-maintained. The room was...More"
1,"We were not impressed with this Hotel or staff, very impersonal, very little people skills and certainly no value,  we had just travelled from Orlando and previous to this hotel were able to gauge this establishment on the previous five hotels, motel and this did...More"
4,"Very cool place. Old and charming. We stayed in room 404, which happened to be Spencer Tracys room. Comfy and cozy  my only complaint was replacing the keys each day because the magnetic strip was off. After an all day adventure, the last thing...More"
1,"This hotel is old and dusty and sad. Pea green room, 5 watt light bulbs, tiny bath, dusty blinds, creepy carpet, insufficient towels, indifferent staff. Nice that it's downtown, but there are plenty of better choices in convenient locations elsewhere in Flagstaff."
4,We had a two bedroom sweet with another couple.  We all shared one bathroom but it was only 89 bucks for the night!  We had the John Wayne suite.  This means there are a couple of posters in the room to give it a John...More
4,We had an ab fab time for 2 nts whilst staying for a grand canyon tour..bar and staff great..atmosphere enjoyable..central and friendly..value for money in the corner suite..Swadee Thai restaurant across road a plus..
2,"Ok, so let me put it straight. Although from Europe, I've been coming to Phoenix for many years, and NEVER was I asked or told that my European ID is not valid (for ordering alcohol) as a form of identification, and that I need a...More"
5,My boyfriend and I stayed up here a couple weeks ago. I had stayed at another older hotel near by just a couple months previous so it was easy to make comparison. This hotel was much more enjoyable. The female at the front desk was...More
3,"I tend to like boutique hotels with personality so for a little more you can stay here and avoid chain hotels. Every room is different and the hotel has lots of history. Rooms can have private bathroom or shared, I always choose private and they...More"
4,"If you are looking for old, quaint, convenient and plain old comfy without the new glitter then this is your hotel. It definitely isn't new and it's not going to be quiet as it's in the middle of downtown with a bar on the first...More"
4,Really enjoyed my stay here. Enjoyed learning the history of the hotel. Check in was easy and room was very comfortable. Staff was very nice and enjoyed relaxing in the bar. This is an old hotel so be prepared to accept the charming but older...More
