score,review
4,"I was with my husband, and a few friends (5 of us total) and we had booked a two bedroom suite. Upon check in, the gal working the desk was super cute and friendly. She answered our million questions and gave us a brief little...More"
3,"This place is an interesting mix of really cool and not. Room sizes were nice, beds comfortable and great location. Not so cool were the small bathrooms with no fans or ventilation, and the large envelopes from the maids asking for tips for cleaning the...More"
5,"Yes, we know the rooms are outdated and funky with a charmed history, but isn't that the fun of it all?  This place is so unique with wood appointments, and iron work, chandeliers all blended wildly.  If this is not what you like, don't stay...More"
5,"We went to the Grand Canyon from Phoenix, so visit Flagstaff was an option and we stayed a night over. The hotel
Is plenty of history, it has is own character and style. My daughter and I had the Bop Hope suite and the bed...More"
4,"This is my second stay at Monte Vista, it was okay first time, no problems. The king room I'm in now is much nicer, and comfortable. Bathroom is great, with a large jetted bathtub. Renovation looks fairly recent, art work in the room really looks...More"
4,"I am not sure why folks post such negative reviews about this spot. If you are looking for a generic chain hotel, go stay at one. My partner and I prefer a spot with a bit of history and character and the Hotel Monte Vista...More"
3,"This is a good historic hotel, lots of character. Our king room on the fourth floor was a good size. There was a sink in the room, with a small bathroom with the toilet and shower. You have to like this sort of place or...More"
4,Great place to stay which is out of the ordinary . The history of the hotel is interesting and the named rooms after film stars make it all the more special . Kind of wanted to see a ghost to tell family back home ....More
5,"My husband and were visiting a nearby town to view some property and wanting a midway point to spend one night, we also wanted to check out some local restaurants and do a little shopping the night before. Downtown Flagstaff is full of both.
My...More"
3,If you like staying in historic districts this is a good hotel. It caters to the college age as does all of the downtown historic district since this is a college town. Each room is decorated different and is named after someone famous who stayed...More
4,Elegant and art deco.  Ask for upper room because of street noise.  Parking is not good its easier to pay across street.  This old Haunted Hotel has an interesting history of many famous people staying here.  We had tiny room 216 love my mauve colored...More
5,knew this could be noisy at night and the staff accommodated with a room away from the music...very lively spot in the old town area and absolutely central...had a great vibe to it and had a drink in the bar very pleasant...old worlde charm meets...More
3,"Pleasantly surprised at the location: smack dab in the middle of all that's happening in Flagstaff. Street dance going on; dinner at Shift, a fantastic restaurant across the street. Monte Vista has a cool, vintage vibe to it, and the staff was nice. The room...More"
3,"Great location and nicely restored, this historic hotel is fun and very well located. Rooms are small, but this was to be expected.

Their main pitfalls are dodgy wifi and poor air conditioning in rooms."
1,"Good: Located pretty much in the middle of town, this is central to everything you'd need in Flagstaff.  It's a short walk to the best restaurants, and the atmosphere on the street is great.. while you're part of it...

Bad:  The walls are paper thin....More"
4,"My sister and I stayed here for 3 nights.  The hotel is in a good location, within walking distance to The main street.  First opinion was very nice.  The rooms are fine, even though the bathroom sink is in the bedroom part but it does...More"
4,I have always wanted to spend a few days in one of Flagstaff's historic hotels and was very happy with our choice of the Monte Vista. It is a beautiful building yes old but that is the point right? The staff was friendly and they...More
5,"Nothing like staying in a cool hotel rumored to be haunted in a cool town.  The atmosphere of this place is awesome; locals and tourists alike fill the lobby and bars, the hallways are full of stories, and the staff is great.  Our room was...More"
3,"If you are a fan of historic old hotels, you will enjoy the ambience of the front desk and lobby/coffee shop area.  However, old Arizona hotels also means tiny rooms with tiny bathrooms.  The fourth floor facing north has decent views."
2,"This place is all HYPE and no substance. I get it, you're old and haunted. Great. Now how about your clean your sink drains because they don't drain and have hunks of the grossest stuff imaginable in them! Also, it is abnormally hot in AZ,...More"
4,"Flagstaff is full of bland chain hotels. The Monte Vista is far from that crowd. Right downtown in the middle of the action. My sister, my husband and I shared a two bedroom suite. The rooms and bathroom were small but adequate. Fans and air...More"
1,"I was shocked when I went into my room, it was tiny and filthy.  The shower was 2'x2'x2' - impossible to bend over and had almost no water pressure.  The bathroom sink was in the bedroom next to the bed.  The closet was about 6""...More"
4,"We stopped in the bar while walking around downtown Flagstaff.  Totally cool vibe, with locals, bikers, hipsters, etc.  We were greeted right away from the bartender, who had a great smile!  We felt welcomed and enjoyed a cool beverage while people watching from the huge...More"
2,"The best I can say is this hotel is in the center of the historic district, within walking distance of many bars and restaurants. If you are under 30 and into the bar scene and just fall in bed oblivious and nothing wakes you up,...More"
4,"The Monte Vista is situated in downtown Flagstaff surrounded by all sorts of quality restaurants, intriguing stores, and beautiful outdoor surroundings.  It's an older hotel with lots of unique characteristics of the era that it was built in.  I'm happy to note that the owners...More"
2,Would liked to give this a better review had a 4th floor room with a great view nice location but the bars on the first floor are crowded and loud till the early morning came back from a day at the Grand Canyon only to...More
5,"Heading for Phoenix, a coffee in Flagstaff, and there at the end of the street was the Monte Vista. Great staff, helpful check in, the room was over all clean and spacious, (could be dusted a bit better the top of the alcove in the...More"
5,"We arrived by rail, 2 hours and 45 minutes late.  So happy these neon lights were lit up and waiting for us.  Awesome room, newly remodeled and very comfortable.  Staff very knowledgeable of town and helpful."
2,"Not a fan. Our room was uncomfortable,small and very outdated. No ventilation in the tiny bathroom. The tiny sinks sits in front of the bed. You need to crank your head to view the TV. Just bad. I would not come back. Location is nice...More"
3,"Very reasonable priced, clean and unique hotel. Stayed two nights and would come back again. If you're looking for the Hilton not your place, but if your looking for an old time hotel, that's clean, friendly, walking distance to train station, restaurants and downtown stores...More"
5,"The Hotel Monte Vista is in the historic district of Flagstaff. It was a fun location, with lots of opportunities when on foot. The hotel itself was wonderful. The staff were friendly, the room was clean and many are named after celebrities that stayed in...More"
3,"This old historic downtown Flagstaff hotel is conveniently located in downtown Flagstaff. We stayed in the Bob Hope Suite. In past years, many celebrities have stay here like Bob Hope, Bing Crosby, etc. There are also claims of ghost sightings. Though we did not see...More"
4,"Great place. Comfortable, with a very energetic beat. Rooms are dated, but clean and well laid out. No coffee makers/mini-frigs, etc, but good excuse to get out and enjoy local flavor. Coffee is available at lobby bar, which is very pleasant. Caroline at the front...More"
4,Nice to see that the hotel has been renovated and operating as this is an historic building with lots of character. The upper three floors are hotel rooms and the first floor is a focal spot for lots of young people enjoying the night in...More
5,"This historic renovated and supposed haunted gem turned out to be a home run!
I must admit I was a bit leary when my husband booked this for an upcoming trip.
But once we arrived and I saw the ornate details that have beenrestored within...More"
1,"We had friends stay here before and liked it, so we booked in for 2 nights - Friday and Saturday.  The rooms were clean and themed, kind of small but standard amenities so looked promising.  Friday night we came back from dinner and found the...More"
4,"Very close to the Amtrak Station. Great rooms and a very friendly bar. Very nice staff and we had a good nights sleep on both nights, very close to some great places to eat  We did stay in two different rooms on our stays"
5,"Classic early 20th Century western hotel, sited in lively part of old Flagstaff.  Comfortable rooms, coffee bar and regular bar in lobby.  Lively nightlife in area (somewhat noisy).   Great historic photos in lobby.  Helpful staff."
4,"We stayed here the day after Christmas so it was a busy time, at night a little noisy with people partying (doesn't really bother us but if it is an issue for you ask for a room away from the street.) We stayed in the...More"
4,"My wife and I were on our way to the Grand Canyon and decided to stay one night enroute in  Flagstaff. After reviewing hotel options, I decided to book a room at the Monte Vista in old town Flag.

For someone expecting a resort level...More"
5,"my girlfriend and I stayed here in the fall and were on the top floor "" Air Supply"" room. Rooms have always been pleasant and clean in my experience and it's nice to see a hotel that has some personality."
1,Over priced. Very noisy. No House guest parking. No breakfast option. Staff functioned but seemed disinterested. Room small but nice and bright. Black gunk came out of the Spa bath when operated. Better places in Flagstaff than this one.
4,"Old Hotel in the Middle of Downtown Flagstaff. Lots of History there. I stayed in the John Wayne Suite on the 4th Floor. 3rd and 4th Floor rooms recommended, due to noise from Bar/band on Friday on First Floor. The Suite was nice as that...More"
3,I always like to stay in historic hotels & this one did not disappoint in that aspect. It is where you need to be to shop with a variety of restaurants nearby. The parking area is really small so you may have to park on...More
4,"My boyfriend and I stayed at the Hotel Monte Vista for one night and had a really great time. How could we not stay in a haunted hotel? 

Well, we didn't get to stay in any of the fabled rooms. As far as I know,...More"
4,"This hotel more less stands at the centre of the older part of Flagstaff and is an imposing redbrick building from the 1920s, replete with bars and pool room There are music nights here and the lobby and public rooms feel quite authentic. Our bedroom...More"
3,We stayed in this hotel on a Thursday night and were extremely pleased with the room we were assigned.  It was on the 4th floor and the hotel clerk said it would be quiet because it was facing San Francisco Street.  I thought that was...More
5,"Great historical property with tons of charm and character. Very lively bar and lounge, obviously a local favorite. Stayed in the Freddie Mercury room in the 4th floor and found it very comfortable and clean with details like wood molding and doors, period furniture, etc....More"
5,"What a wonderful experience!  This historic hotel fits right into the old town atmosphere of downtown old town Flagstaff.  The bar, lounge and lobby are warm and inviting.  Each room is named for one of the characters that made it famous.  Our room was the...More"
4,"Great hotel if you're on a road trip

Plenty of character and in the historic town centre. 

The rooms are a bit dark and not too spacious. no wardrobe to hang your cloths but heyho we're on a road trip and looking for laid back...More"
3,I stayed at the Monte Vista on a Saturday night on a weekend that I was visiting my daughter at NAU. We stayed in the Presidential Sweet. The Monte Vista is a really interesting old hotel and a great place to stay. The hotel is...More
5,"We stayed at the Monte Vista for two nights and greatly enjoyed our stay. The history of the hotel and the other surrounding buildings was fascinating. There are a ton of great local eateries and bars all within walking distance. Parking is a little tight,...More"
5,"Come on, this is not a Four Seasons/Ritz kinda place. This is a funky, sorta restored, rustic old hotel in the old downtown area of Flagstaff. It is a place to enjoy history - a true throwback to old West & mountain days, convenient to...More"
3,"Three friends stayed at the hotel after visiting Antelope Canyon and Horseshoe Bend in Page, AZ. The hotel brags of being 'haunted' so we had to stay here!! And in the Presidential Suite no less! What a fun experience! We then went down to the...More"
3,We stayed at the Hotel Monte Vista for 2 nights as we explored the Grand Canyon. It was fun to stay at a place that had a lot of character and avoid the typical hotel chains. We stayed in the Debbie Reynolds room on the...More
4,Enjoyed our stay and perfect location to explore downtown Flagstaff. Comfortable room with some neat updates. Bathroom needs some hooks to hang clothes/towels. Brewery to the south had nice craft beers and nice menu.
3,"I stayed a couple of nights at the Monte Vista, I was a bit non-plussed about the named rooms. I was in the one dedicated to Air Supply and I thought they put me in the Janitors Closet. It was fine though and on the...More"
4,"OK, so the room wasn't that great, It was clean, however.  The carpet in the public hallway and stairwell was dirty and it made us a little concerned until we saw the room.  The front desk staff person was very nice and very helpful.  We...More"
3,Stumbled on to Hotel Monte Vista on a road trip with my girlfriend more or less by accident as we didn't even really have a plan to necessarily stay in Flagstaff. The hotel itself is relatively nice. Very retro and true to its origins. The...More
3,We were thrilled to get parking right by the hotel in their little parking lot next to the bar. Check in was uncomplicated and I liked that we were given detergent and fabric softener when I said we needed to do laundry. The reason for...More
4,"It is not a fancy hotel but it's really charming. Simple in its structure and services, will make you feel part of the route66 history. The room we had was nice and clean and with some charm. I'd not recommend the breakfast in the hotel,...More"
4,"Booked in here today late afternoon, nice hotel but not by any means Vegas standards, But , quaint , clean , and really everything you might need, and the bar downstairs is excellent, fab bar staff and an exstreamly nice place to be, as is...More"
5,"The Hotel Monte Vista is a 'must stay' if in Flagstaff. Built in the 1920s, the hotel has plenty of character and stories (true or otherwise) about it. It allegedly had a 'speakeasy' in the basement during prohibition and several of the rooms have ghostly...More"
4,Loved this hotel. Even though hotel was built in the 1920's it was very comfortable and clean. I stayed in the Anthony Hopkins suite with 1 queen bed and private bathroom. Price was reasonable for a weekend in summer. My bed was very comfortable and...More
3,"We love the location of this place and it's old timey charm. Each room is different and vastly differs from the next. The cocktail lounge, bar and coffeehouse located on site are always fun with great service and the ""hauntings"" always add a little extra...More"
3,"The hotel is great for things in the downtown Flag area...super easy walking distance to local bars and restaurants.
We stayed in room 407 and knew it overlooked the street - ie Monte V lounge. If noise bothers you...pick another room/side. We loved hearing the...More"
4,This was my third stay at the Monte Vista over the course of 15 years. I love it most for its location in the heart of walkable downtown Flagstaff. It's 100 years old (but updated) with a rich and varied history apropos of a small...More
4,Stayed here for a night in April of 16 - really enjoyed our stay. We stayed in the Bon Jovi Room which was funny being I am from NJ- Cool old style room...Not much to do in Flagstaff tho....Stopped here from GC on way to...More
4,"My husband and I stayed one night at The Hotel Monte Vista. Our experience was a good one and I was happily surprised that there was an AC unit in our room (307, Debbie Reynolds)! The two bars downstairs and downtown location made for the...More"
4,"When I booked this hotel, I asked about parking. I was told they had a small lot and there was on street parking.
When we got there, the tiny lot for the hotel also served the bar and it was full. I called again and...More"
5,"We had a great stay at the Hotel Monte Vista.  Clara at the front desk and Steve Kaufman were very friendly.  We stayed at the Monte Vista on an excessively hot weekend with record heat, but were comfortably cool in our room.  Definitely stay on...More"
5,Due to a travel agent mistake we were in Flagstaff without a hotel and it was just incredibly fortunate that we saw this hotel. It is really old-fashioned and quaint and has an amazing atmosphere. There is a great bar which is buzzing the whole...More
2,"I get this is a very eclectic and historic hotel, but that's really no excuse for bad service. I wasn't enamored by the lack of AC and basic creature comforts found in most budget motels, but when it came to housekeeping...this was ridiculous.

I left...More"
5,I absolutely love this hotel.  So charming and so much history.  It fits perfectly with the flagstaff vibe.  Two bars in the hotel and a coffee shop.  Walking distance to tons of bars and restaurants.  Wouldn't stay at any other hotel next time I visit...More
5,"Located in the center of downtown Flagstaff, this is a historic and cool hotel to enjoy.
Near all the restaurant and bars, I really recommend it. This was our 3 time in Flagstaff, but this time we can get reservations in this hotel. we drop...More"
4,"This place is located in the middle of the historic downtown, which is perfect since you can just walk down street for dinner, and go bar hopping, if you'd like. 
Parking lot is small, it is true, but I haven't had problem finding a spot....More"
4,"We love going to our favorite, haunted hotel. And yes I have experience some kind of a supernatural event, however it was only in my last visit after years of no such encounters. I felt a light squeezing of my throat during my sleep that...More"
5,This my favorite hotel in Flagstaff! Location location location for dining and going bar hopping.  The rooms are clean and very different from one another.  The beds are always extremely comfortable! I love looking out the room windows and people watching.  This is a real...More
5,My wife and I had something going on in Sedona last Saturday morning.  We chose to stay in Flagstaff because we never had and it was close to Sedona.  We like the more classic hotels then the more popular chain hotels. We had read a...More
3,"All of the times that my wife and I have traveled to or through Flagstaff, we have always stayed at other places.  I've always wanted to stay at The Monte Vista or the nearby Hotel Weatherford, however.  So during a recent trip up to Lake...More"
2,"Loud, No amenities, way over priced! There are better Hotels/Motels in the area with the hotel amenities one would expect. Motel 6 is even better than this place. There's hardly any parking. People going to the bar in the hotel can take up the parking...More"
3,"My room was nice, the hotel is historic, and the cafe downstairs is great, but don't choose the option of a shared bathroom - there were 2 tiny bathrooms for the entire floor, and they were very dirty, with hairs, used soap, used towels and...More"
4,I liked the ambiance and location. It was a little hard to sleep because of noise from the bar. Next time I'll try asking for a room as far away from that area as possible. The restaurant was good and the front desk was helpful.
4,"The hotel is old, but full of old time charm! Amenities were fine and everything worked.  We went to the bar around 8:30PM on a week night and it was packed with locals and tourists alike.  Great atmosphere and met some terrific people.  Everyone was...More"
3,"Great location, right in the heart of Flagstaff downtown.  You can walk everywhere.  The room was clean and comfortable.  The big negative is there is two bars attached to the hotel, great for getting a drink, but the noise lasts all night long.  People are...More"
4,Came to check out Flagstaff with my daughter and knew I wanted to make it interesting and fun!  I choose to stay here because of its history and charm.  I read the negative reviews and knew what I was getting myself into.  I had no...More
4,"Fast check in, wify work good sometimes not super clean but ok, it was a suite and  they only put me two bath towels and we are 4 . there is little space to put your tooth brush comb etc etc. it is an old...More"
4,"Since there were four of us we needed a double room. The room itself was spacious and comfortable. Walls and furnishings were shades of deep green, giving it a warm, soothing feeling. Beds were firm and comfortable, although we found the pillows a bit overstuffed...More"
5,This motel is a great historical place to stay.The rooms are nice and comfy. It is located right downtown and so you are in walking distance for great places to shop and eat. There is a cocktail lounge for you to sit and enjoy a...More
5,"Ok, if you want a typical hotel, do not stay here! This hotel is for people who want to experience Flagstaff!! The hotel room has old carpet, an old rocking chair and an old dresser...and it was great! The bathroom was small, who cares?! If...More"
3,"It is what it is. Older Railroad Hotel. I was a little leery of the Hotel after reading some of the reviews, but I am coming to the conclusion that a lot of people are just whiney. We went to Flagstaff to see Jesse Cooke...More"
4,"Hotel Monte Vista is right in the heart of downtown Flagstaff. You're surrounded in every direction by restaurants, coffee shops, bars, stores, and activities within walking distance. You can get to two solid establishments downstairs without ever even going outside. The rooms themselves have a...More"
4,"We actually live in Flagstaff, we stayed a night so the girls could look for ghosts.  No ghosts were found but they hotel and bars continue to be places with an incredible amount of character.   A classic historic hotel."
3,Did not stay but took a good look around as the locals say it was one of the first hotels to go up. Considered briefly staying but did not want to double book hotel rooms for the sake of experience. Driveon by and look.
5,We stayed here for 12 days over the recent holidays.  Just so you know; our son manages the Rendezvous bar; which is a very good bar.  Everyone who works here went above and beyond to makes us comfortable.  We spent a number of these nights...More
5,"This bar is so great! The employees are happy, fun, and provide great service. After wasting our time at the Gopher Hole, we ended the night at Monte Vista and had a great time! It has a great ambiance and the stage is always perfect...More"
5,"I usually have no interest in haunted places but this one got me. The place apparently has several ghosts. There are a couple of stories regarding the third floor and I got an eerie feeling when we walked up there. Believe me, these things normally...More"
4,Great location in downtown Flagstaff. We truly had a fun evening exploring the area while walking. It is an older hotel but it has a lot of charm. We stayed in the Humphrey Bogert Room and each room has a theme. There are two bars...More
3,"We stayed one night (Nov 23rd, 2015) - just passing thru Flagstaff.  The room we stayed (#310) was tiny, but equipped with everything needed. The bathroom was super tiny, so much so that the sink is outside the bath in the main part of the...More"
4,"Stayed with my boyfriend as part of our US road trip for 2 nights. Lots of history, cool bar with great service,  also a gig venue serving till late. Receptionist very helpful as we arrived late on Sunday and she recommended somewhere to eat and...More"
1,"Daughter had a tenth anniversary stay planned at Hotel Monte Vista.  Parking lot is a nightmare to figure out where you are supposed to park.  Parked her car to go check in.  Was told that she couldn't park where she had, as she went out...More"
3,"I liked Flagstaff Very Much.

We wanted to stay here as this is noted on Route 66 as a good option.

Okay the room was tiny and the bathroom was the size of a utility cupboard, but we didn't expect to be in the room...More"
4,"After reading the reviews on this hotel ,wasn't sure what to expect. When we arrived ,was met by the most wonderful staff .And they were wonderful the whole of our stay. DONT,,stay in this hotel if you are looking for modern look ,but if you...More"
3,Friendly  service in the bar. Great coffee  drinks  as well as a full  bar.  Big windows  with high seat to watch  the world  walk by and meet on the corner.  Didn't stay in the hotel but it is very historical and centrally  located in the...More
